Chinese,信息標籤,成功標籤,警告標籤,危險標籤
English,information tag, tag indicating success, tag indicating warning, tag indicating danger
French,étiquette d'information, étiquette indiquant le succès, étiquette indiquant l'avertissement, étiquette indiquant le danger
German,Informationstag, Tag der den Erfolg anzeigt, Tag der die Warnung anzeigt, Tag der die Gefahr anzeigt
Italian,tag di informazione, tag che indica il successo, tag che indica avvertimento, tag che indica pericolo
Japanese,情報タグ,成功を示すタグ,警告を示すタグ,危険を示すタグ
Russian,информационный тег, тег указывающий успех, тег указывающий предупреждение, тег указывающий опасность
Spanish,etiqueta de información, etiqueta que indica el éxito, etiqueta que indica advertencia, etiqueta que indica peligro